{
  "result_id": "22222222-2222-2222-2222-222222222222",
  "request_id": "11111111-1111-1111-1111-111111111111",
  "verdict": "UNKNOWN",
  "reason": "Scaffold fixture \u2014 not a real result.",
  "completed_at": "2024-01-01T00:01:00Z",
  "evidence": {
    "probe_count": 0,
    "observations": []
  }
}